{
  "$schema": "https://json-schema.org/draft/2020-12/schema",
  "$id": "https://airlockjs.dev/contracts/instrumentation-config.schema.json",
  "title": "airlock instrumentation config — the boot(config) project config (experimental, NOT frozen)",
  "description": "The project JSON config `boot(config)` (adapters/eds/index.js) consumes: which connectors to instrument (+ their ids/endpoints) and the top-level consent/payload governance. Modelled as the DISCRIMINATED UNION it is: each connector entry's `type` selects one of ga4 / pixel / helix-rum / alloy (oneOf on a `type` const), with a nested `vendor` (meta / linkedin / bing) under `pixel`, and helix-rum's governance-free shape (spec 022 exempts RUM from consent/denylist). Experimental — explicitly NOT frozen: the real-site validation exercises this shape and a later config-surface freeze (a follow-on ADR extending ADR-0017) pins what settles (this is NOT one of architecture.md's five frozen contract surfaces). ALLOY COVERAGE (spec 033-02 + 033-03): Adobe/alloy is covered for BOTH the ANALYTICS vertical (a {type:\"alloy\"} entry boots alloy via bootAlloy through the Edge interact; the stock @adobe/alloy SDK bundle is ADOPTER-SUPPLIED via `bundleUrl`, ADR-0016 — airlock does NOT ship it) AND PERSONALIZATION / decisions-as-data (spec 033-03 + 034-02): the interact's decisions fill pre-reserved CWV-safe boxes via reserveSpace — declared with N `placements` entries of arbitrary scopes (the connector carries them as `decisionScopes`; the host maps each returned decision to its box by scope). So MVP6's named 'GA4 + Adobe/alloy' supported subset is covered for BOTH analytics and personalization. Reference schema only: `boot(config)`'s RUNTIME validation is a lightweight hand-rolled SUBSET (no ajv in the shipped bundle); ajv validates THIS schema in the contracts dev harness (npm run validate).",
  "type": "object",
  "additionalProperties": false,
  "required": ["connectors"],
  "properties": {
    "connectors": {
      "type": "array",
      "minItems": 1,
      "description": "The connectors to instrument, in order. `boot(config)` boots each and returns a composite over them. `{type:\"alloy\"}` covers BOTH the analytics vertical (spec 033-02) and personalization (spec 033-03 + 034-02, via N `placements` entries of arbitrary scopes).",
      "items": { "$ref": "#/$defs/connector" }
    },
    "consent": {
      "type": "object",
      "description": "ADR-0007 consent vector: purpose name -> state (e.g. {\"analytics_storage\":\"granted\",\"ad_storage\":\"denied\"}). Applies to the CONSENT-GOVERNED connectors (GA4, pixels); helix-rum is EXEMPT (spec 022 — RUM is not consent-gated). An open taxonomy, so purpose names are unconstrained; values are strings resolved case-insensitively (granted/denied; anything else -> pending).",
      "additionalProperties": { "type": "string" }
    },
    "consentStrict": {
      "type": "boolean",
      "description": "spec 017-03 AC3 — a strict / no-processing regime for the consent-governed connectors."
    },
    "payloadDenylist": {
      "type": "array",
      "description": "spec 019-01 (ADR-0012) — extra payload keys stripped before egress, merged with the always-on built-in default. Applies to consent-governed connectors; helix-rum is exempt.",
      "items": { "type": "string" }
    }
  },
  "$defs": {
    "connector": {
      "type": "object",
      "required": ["type"],
      "description": "A single connector entry — a discriminated union on `type` (ga4 / ga4-gtag / pixel / helix-rum / alloy / google-ads / floodlight). alloy covers analytics (spec 033-02) AND personalization (spec 033-03, via `placements`).",
      "oneOf": [
        { "$ref": "#/$defs/ga4Connector" },
        { "$ref": "#/$defs/ga4GtagConnector" },
        { "$ref": "#/$defs/pixelConnector" },
        { "$ref": "#/$defs/helixRumConnector" },
        { "$ref": "#/$defs/alloyConnector" },
        { "$ref": "#/$defs/googleAdsConnector" },
        { "$ref": "#/$defs/floodlightConnector" }
      ]
    },
    "ga4Connector": {
      "type": "object",
      "additionalProperties": false,
      "required": ["type"],
      "description": "GA4 (analytics). Consent-governed; the top-level consent/consentStrict/payloadDenylist are threaded in. GA4's measurement_id/api_secret live in the collect endpoint URL, not as a config id.",
      "properties": {
        "type": { "const": "ga4" },
        "endpoints": {
          "type": "array",
          "minItems": 1,
          "items": { "type": "string" },
          "description": "Optional collect endpoint(s); defaults to the placeholder GA4 MP collect URL."
        },
        "trackers": { "type": "integer", "minimum": 1 },
        "ctx": {
          "type": "object",
          "description": "Optional pre-sourced identity snapshot; when absent, sourced host-side from the _ga cookie (004-03)."
        }
      }
    },
    "ga4GtagConnector": {
      "type": "object",
      "additionalProperties": false,
      "required": ["type", "measurementId"],
      "description": "GA4 gtag protocol (spec 041) — a container's own GA4 tag beacon (`/g/collect`, authed by `tid` + origin, no `api_secret`) reproduced off-thread (`bootGa4Gtag`). Consent-governed; the top-level consent/consentStrict/payloadDenylist are threaded in exactly like `ga4`/`pixel` (no exemption). Unlike `ga4` (whose measurement_id/api_secret live embedded in the MP collect endpoint URL), the gtag protocol's `tid` is an explicit REQUIRED top-level field.",
      "properties": {
        "type": { "const": "ga4-gtag" },
        "measurementId": { "type": "string", "minLength": 1, "description": "The GA4 measurement id (`tid`, REQUIRED)." },
        "streamCookieName": { "type": "string", "description": "The concrete `_ga_<STREAM>` cookie name for session-state read-modify-write (039-03/041-02). Absent -> the session-state write is skipped entirely." },
        "consentDefault": {
          "type": "object",
          "description": "Host-declared ADR-0007 Consent-Mode default vector (`gtag('consent','default',…)`), gating `gcd` (039-05/041-02).",
          "additionalProperties": { "type": "string" }
        },
        "endpoint": { "type": "string", "description": "Optional /g/collect endpoint override (default the pinned GA4_GTAG_COLLECT_ENDPOINT)." },
        "ctx": {
          "type": "object",
          "description": "Optional pre-sourced identity snapshot; when absent, sourced host-side from the _ga/_ga_<stream> cookies (mirrors the ga4 connector's own ctx sourcing)."
        }
      }
    },
    "pixelConnector": {
      "type": "object",
      "required": ["type", "vendor"],
      "description": "An ads/remarketing pixel. Consent-governed (ad_storage). Nested discrimination on `vendor` (meta / linkedin / bing), each requiring its own vendor id.",
      "properties": { "type": { "const": "pixel" } },
      "oneOf": [
        {
          "additionalProperties": false,
          "required": ["type", "vendor", "pixelId"],
          "properties": {
            "type": { "const": "pixel" },
            "vendor": { "const": "meta" },
            "pixelId": { "type": "string", "minLength": 1, "description": "Meta pixel id (REQUIRED)." },
            "endpoint": { "type": "string" }
          }
        },
        {
          "additionalProperties": false,
          "required": ["type", "vendor", "partnerId"],
          "properties": {
            "type": { "const": "pixel" },
            "vendor": { "const": "linkedin" },
            "partnerId": { "type": "string", "minLength": 1, "description": "LinkedIn partner id (REQUIRED)." },
            "conversionId": { "type": "string", "minLength": 1, "description": "Optional LinkedIn conversion id for the `lead` event." },
            "endpoint": { "type": "string" }
          }
        },
        {
          "additionalProperties": false,
          "required": ["type", "vendor", "tagId"],
          "properties": {
            "type": { "const": "pixel" },
            "vendor": { "const": "bing" },
            "tagId": { "type": "string", "minLength": 1, "description": "Bing UET tag id (REQUIRED)." },
            "endpoint": { "type": "string" }
          }
        }
      ]
    },
    "googleAdsConnector": {
      "type": "object",
      "additionalProperties": false,
      "required": ["type", "conversionId"],
      "description": "Google Ads (AW) page-load remarketing/conversion beacon (spec 044 / 048-01) — a container's own `ccm/collect` beacon reproduced off-thread (`bootGoogleAds`), hosted in its own worker chamber mirroring `ga4-gtag`'s. Consent-governed (`ad_storage`); the top-level consent/consentStrict/payloadDenylist are threaded in exactly like `ga4`/`ga4-gtag` (no exemption), PLUS `holdOnDenied` (045-01): a denied-`ad_storage` beacon holds at the seal and is re-mapped + flushed on a later grant.",
      "properties": {
        "type": { "const": "google-ads" },
        "conversionId": { "type": "string", "minLength": 1, "description": "The AW conversion id (`tid`, e.g. \"AW-1234567890\", REQUIRED)." },
        "consentDefault": {
          "type": "object",
          "description": "Host-declared ADR-0007 Consent-Mode default vector (`gtag('consent','default',…)`), gating `gcd` — mirrors ga4-gtag's own `consentDefault` (039-05/041-02); threaded into BOTH the steady-state beacon AND the held→grant-flush re-map (048-01 fix round) so the two paths encode the SAME `gcd`.",
          "additionalProperties": { "type": "string" }
        },
        "endpoint": { "type": "string", "description": "Optional ccm/collect endpoint override (default the pinned GOOGLE_ADS_CCM_COLLECT_ENDPOINT)." },
        "ctx": {
          "type": "object",
          "description": "Optional pre-sourced identity snapshot ({auid?, gclid?, wbraid?, gbraid?}); when absent, sourced host-side from the _gcl_au cookie + inbound click ids (connectors/google-ads/cookies.js)."
        }
      }
    },
    "floodlightConnector": {
      "type": "object",
      "additionalProperties": false,
      "required": ["type", "conversionId"],
      "description": "Floodlight (DC) page-load beacon(s) (spec 046 / 048-02) — a container's own `ccm/collect` beacon (ALWAYS) reproduced off-thread (`bootFloodlight`), PLUS the `;`-delimited `activity` beacon (when `src` is configured) — hosted in its own worker chamber mirroring `google-ads`'s. Consent-governed (`ad_storage`); the top-level consent/consentStrict/payloadDenylist are threaded in exactly like `ga4`/`google-ads` (no exemption), PLUS `holdOnDenied` (046-03): a denied-`ad_storage` beacon (either form) holds at the seal and is re-mapped + flushed on a later grant. NOTE: the Floodlight-native activity tag is named `activityType` here (NOT `type`) — `type` is reserved as this entry's own connector-kind discriminant (`\"floodlight\"`); `bootFloodlight` translates `activityType` to the connector's internal `type` config field.",
      "properties": {
        "type": { "const": "floodlight" },
        "conversionId": { "type": "string", "minLength": 1, "description": "The DC conversion id (`tid`, e.g. \"DC-1234567890\", REQUIRED)." },
        "src": { "type": "string", "description": "The Floodlight-native activity identity. Its mere PRESENCE gates whether the `;`-matrix activity beacon/endpoint exist at all (absent -> ccm/collect ONLY, byte-identical to a 046-01-only boot)." },
        "activityType": { "type": "string", "description": "The Floodlight-native activity `type` tag (renamed from the connector's own `type` field to avoid colliding with this entry's `type` discriminant, 048-02 AC3)." },
        "cat": { "type": "string", "description": "The Floodlight-native activity `cat` tag." },
        "consentDefault": {
          "type": "object",
          "description": "Host-declared ADR-0007 Consent-Mode default vector (`gtag('consent','default',…)`), gating `gcd` — mirrors google-ads' own `consentDefault`; threaded into BOTH the steady-state beacon(s) AND the held→grant-flush re-map so all paths encode the SAME `gcd`.",
          "additionalProperties": { "type": "string" }
        },
        "endpoint": { "type": "string", "description": "Optional ccm/collect endpoint override (default the pinned FLOODLIGHT_CCM_COLLECT_ENDPOINT)." },
        "activityEndpoint": { "type": "string", "description": "Optional activity endpoint override (default the pinned FLOODLIGHT_ACTIVITY_ENDPOINT)." },
        "ctx": {
          "type": "object",
          "description": "Optional pre-sourced identity snapshot ({auid?, gclid?, wbraid?, gbraid?}); when absent, sourced host-side from the _gcl_au cookie + inbound click ids (REUSES connectors/google-ads/cookies.js verbatim — DC's auid/auiddc IS the SAME _gcl_au-derived value)."
        }
      }
    },
    "helixRumConnector": {
      "type": "object",
      "additionalProperties": false,
      "required": ["type"],
      "description": "helix-rum (RUM authority). GOVERNANCE-FREE shape (spec 022): NOT consent-gated, no payload denylist — the top-level consent/consentStrict/payloadDenylist do NOT gate or strip it, and it carries none of those fields itself.",
      "properties": {
        "type": { "const": "helix-rum" },
        "collectBaseURL": { "type": "string", "description": "RUM collector base (default ot.aem.live)." },
        "rate": { "type": "string", "description": "A sampleRUM rate name (on/high/medium/low/off)." },
        "weight": { "type": "number", "description": "A raw sampling weight (wins over `rate`)." },
        "referer": { "type": "string", "description": "Host-sourced page referer (default document.referrer)." }
      }
    },
    "alloyConnector": {
      "type": "object",
      "additionalProperties": false,
      "required": ["type", "bundleUrl"],
      "anyOf": [
        { "required": ["datastreamId"] },
        { "required": ["datastream"] },
        { "required": ["edgeConfigId"] }
      ],
      "description": "Adobe/alloy — ANALYTICS (spec 033-02) + PERSONALIZATION (spec 033-03): boots the stock @adobe/alloy Web SDK in airlock's classic chamber, egresses one Analytics pageView via the Edge interact, AND (033-03) delivers Target personalization as data — the interact's `__view__` decisions fill a pre-reserved CWV-safe box via reserveSpace (see `placements`). Requires `bundleUrl` AND a datastream id (`datastreamId`, or its `datastream`/`edgeConfigId` alias) — alloy configure() needs it AND it is the config-integrity tenant pin (spec 015 / ADR-0011: the `configId` the honest Edge interact carries; a re-tenant to an attacker org is HELD at the seam). The endpoint-ceiling pins the grounded interact FLOOR (016-02). Consent-governed (analytics_storage + personalization) — the top-level consent/consentStrict/payloadDenylist are threaded in (the strict seam gate: a denied OR pending governing purpose DROPS the WHOLE interact — so a personalization denial holds analytics too, the 020-02 all-or-nothing behavior). The stock SDK bundle is ADOPTER-SUPPLIED via `bundleUrl` (ADR-0016 — airlock does NOT ship it; same-origin byte-pinned recommended, cross-origin supported). Personalization supports N placements of arbitrary scopes (spec 034-02): the connector carries the declared scopes on the interact (`decisionScopes`) and the host maps each returned decision to its box by scope; duplicate scopes are rejected.",
      "properties": {
        "type": { "const": "alloy" },
        "bundleUrl": { "type": "string", "minLength": 1, "description": "URL to the ADOPTER-SUPPLIED stock @adobe/alloy bundle the chamber importScripts (REQUIRED — ADR-0016; airlock does not ship it). Same-origin byte-pinned recommended; a cross-origin Adobe-CDN URL is supported with the stated integrity/CSP trade-off." },
        "datastreamId": { "type": "string", "description": "alloy configure() datastream id (the Edge config id)." },
        "orgId": { "type": "string", "description": "alloy configure() IMS org id." },
        "datastream": { "type": "string", "description": "Alias for datastreamId." },
        "edgeConfigId": { "type": "string", "description": "Alias for datastreamId." },
        "context": { "type": "array", "description": "alloy configure() context array (default [] — the chamber is headless, no ambient auto-collection)." },
        "placements": {
          "type": "array",
          "uniqueItems": true,
          "description": "spec 033-03 + 034-02 — Target personalization placements (decisions-as-data → reserveSpace). N entries of ARBITRARY scopes (spec 034-02): the connector carries the declared `scope`s on the interact (`decisionScopes`) so alloy fetches each, and the host maps every returned decision to its box BY SCOPE. Each entry names a CWV-safe box airlock reserves BEFORE paint (loadEager, via reservePersonalization) and FILLS with that scope's decision HTML via reserveSpace once the lazy interact returns it. DUPLICATE scopes are REJECTED (`uniqueItems` catches identical entries here; the hand-rolled runtime validator additionally rejects any two placements sharing a `scope`, even with different selectors — the scope-keyed reserve/deliver maps would otherwise collapse last-wins). The per-scope Edge/Target RESPONSE is server behavior — rig-proven with a stub, live-Alloy creds-gated (013 pattern).",
          "items": {
            "type": "object",
            "additionalProperties": false,
            "required": ["scope", "selector", "minHeight"],
            "properties": {
              "scope": { "type": "string", "minLength": 1, "description": "The personalization scope (e.g. `__view__` for above-the-fold, or a named Target scope like `products`). Any non-empty string (spec 034-02 — multi-scope). Must be unique across `placements` (the scope-keyed map would otherwise collapse last-wins)." },
              "selector": { "type": "string", "minLength": 1, "description": "CSS selector for the box to reserve + fill." },
              "minHeight": { "type": "number", "minimum": 0, "description": "Reserved box min-height (px) — sized before paint so the later fill causes no reflow (max-height/overflow:clip cap the box; 018-02)." },
              "prehide": { "type": "boolean", "description": "Prehide the box content (visibility:hidden, still in flow) until fill or the reveal-backstop timeout (default true)." },
              "timeout": { "type": "number", "minimum": 0, "description": "Prehide reveal-backstop timeout (ms) — a decision that never arrives still reveals the box." }
            }
          }
        }
      }
    }
  }
}
